{"$schema":"https://json-schema.org/draft/2020-12/schema","type":"object","additionalProperties":false,"required":["artifact_kind","publishable","candidate_id","classification_id","taxonomy_version","review","field_decisions"],"properties":{"artifact_kind":{"const":"predator_intermediate_reviewed_candidate"},"publishable":{"const":false},"candidate_id":{"type":"string","minLength":1},"classification_id":{"type":"string","minLength":1},"batch_id":{"type":"string"},"taxonomy_version":{"type":"string"},"schema_version":{"type":"string"},"canonical_index_version":{"type":"string"},"classification_policy_version":{"type":"integer"},"review_version":{"type":"integer"},"input_hash":{"type":"string"},"review":{"type":"object","required":["decision","reviewer_id","occurred_at"]},"field_decisions":{"type":"array"}}}
